{"artifact_id":"art_52448b644ceecc6635306abd3c073f30","content_hash":{"algorithm":"sha256","digest":"52448b644ceecc6635306abd3c073f30b2821dc50ef96230076ab0e3dbcee1b0"},"derivation":null,"locator":{"identifier":null,"repository_ref":null,"url":"https://chatgpt.com/share/6a820cf1-1060-83ea-9831-82a8ae4c4ddb?ogimg=plain"},"published_at":null,"quality":{"authority":null,"directness":1.0,"independence":0.0,"notes":"Raw public shared-page HTML captured for provenance; rendered message content remains reconstructed.","reproducibility":0.8,"timeliness":1.0},"retrieved_at":"2026-08-16T00:00:00Z","schema_version":"fossil.source-snapshot.v1","snapshot_id":"snap_c274226b788a611eb2ffaa1b","source_id":"source_2cda347765c733d2222a","source_role":"local","version_metadata":{"commit_sha":null,"etag":null,"last_modified":null,"version_id":"shared-page-html-capture-2026-08-16"}}
