{"artifact_id":"art_0ec8dbecf87951c91b7f196776a33167","content_hash":{"algorithm":"sha256","digest":"0ec8dbecf87951c91b7f196776a3316742ac3bf02884bd76b3d02f8ed0cb8680"},"derivation":{"method":"visible-payload-normalization","parent_snapshot_refs":["snap_c274226b788a611eb2ffaa1b"]},"locator":{"identifier":null,"repository_ref":null,"url":"https://chatgpt.com/share/6a820cf1-1060-83ea-9831-82a8ae4c4ddb?ogimg=plain"},"published_at":null,"quality":{"authority":null,"directness":0.4,"independence":0.0,"notes":"Normalized reconstruction derived from the raw shared-page capture; not a verbatim export.","reproducibility":0.8,"timeliness":1.0},"retrieved_at":"2026-08-16T00:00:00Z","schema_version":"fossil.source-snapshot.v1","snapshot_id":"snap_6b022ba69fa4eb1af63b726c","source_id":"source_2cda347765c733d2222a","source_role":"reconstructed","version_metadata":{"commit_sha":null,"etag":null,"last_modified":null,"version_id":"normalized-transcript-2026-08-16"}}
