{"artifact_id":"art_3a50d9aab02a8f1765b5b118f6601671","content_hash":{"algorithm":"sha256","digest":"3a50d9aab02a8f1765b5b118f6601671ea804bc3eb39121abd52852705a21375"},"derivation":{"method":"visible-payload-normalization","parent_snapshot_refs":["snap_f3aafab84862cd0218a05ed2"]},"locator":{"identifier":null,"repository_ref":null,"url":"https://chatgpt.com/share/6a81ec29-8d24-83ea-9fdd-db97df8ee576?ogimg=plain"},"published_at":null,"quality":{"authority":null,"directness":0.4,"independence":0.0,"notes":"Normalized decision-bearing reconstruction derived from the raw shared-page capture; not a verbatim export.","reproducibility":0.8,"timeliness":1.0},"retrieved_at":"2026-08-16T00:00:00Z","schema_version":"fossil.source-snapshot.v1","snapshot_id":"snap_111c06b794cbc9aea14f5868","source_id":"source_d426b66b9e2bb37370d5","source_role":"reconstructed","version_metadata":{"commit_sha":null,"etag":null,"last_modified":null,"version_id":"normalized-transcript-2026-08-16"}}
