{"artifact_id":"art_56c769274e4f0474c7e39da56810b58c","content_hash":{"algorithm":"sha256","digest":"56c769274e4f0474c7e39da56810b58cae0dc9239a628b80d1e3e27d54f252a4"},"derivation":null,"locator":{"identifier":null,"repository_ref":null,"url":"https://chatgpt.com/share/6a81ec29-8d24-83ea-9fdd-db97df8ee576?ogimg=plain"},"published_at":null,"quality":{"authority":null,"directness":1.0,"independence":0.0,"notes":"Raw public shared-page HTML captured for provenance; rendered message content remains a reconstructed source.","reproducibility":0.8,"timeliness":1.0},"retrieved_at":"2026-08-16T00:00:00Z","schema_version":"fossil.source-snapshot.v1","snapshot_id":"snap_f3aafab84862cd0218a05ed2","source_id":"source_d426b66b9e2bb37370d5","source_role":"local","version_metadata":{"commit_sha":null,"etag":null,"last_modified":null,"version_id":"shared-page-html-capture-2026-08-16"}}
